{"$id":"yggdrasil/contracts/v1/quant_fitness_policy","$schema":"https://json-schema.org/draft/2020-12/schema","additionalProperties":false,"properties":{"format_requirements":{"items":{"additionalProperties":false,"properties":{"format":{"minLength":1,"type":"string"},"requires_accelerator":{"enum":["cuda","hailo","npu","metal",null],"type":["string","null"]}},"required":["format","requires_accelerator"],"type":"object"},"minItems":1,"type":"array"},"headroom_factor":{"minimum":1,"type":"number"},"on_unknown_format":{"const":"refuse"},"policy":{"pattern":"^[a-z0-9][a-z0-9-]*-v[0-9]+$","type":"string"},"roadmap_slice":{"pattern":"^Y-[0-9]{3}$","type":"string"},"version":{"const":1}},"required":["version","policy","roadmap_slice","headroom_factor","on_unknown_format","format_requirements"],"title":"QuantFitnessPolicy v1 — the quantisation fitness rules as data: the headroom a quant must leave beyond its file size, and which accelerator (if any) each format's runtime requires (Y-038)","type":"object"}