{"format_requirements": [{"format": "gguf", "requires_accelerator": null}, {"format": "ggml", "requires_accelerator": null}, {"format": "awq", "requires_accelerator": "cuda"}, {"format": "gptq", "requires_accelerator": "cuda"}, {"format": "exl2", "requires_accelerator": "cuda"}, {"format": "mlx", "requires_accelerator": "metal"}], "headroom_factor": 1.25, "on_unknown_format": "refuse", "policy": "yggdrasil-quant-fitness-v1", "roadmap_slice": "Y-038", "version": 1}
